{
  "kind": "species",
  "id": "carbonate-ion",
  "title": "Carbonate ion",
  "formula": "CO3^2-",
  "latex": "\\mathrm{CO_{3}}^{2-}",
  "species_class": "polyatomic-ion",
  "names": [
    "carbonate",
    "carbonate ion"
  ],
  "charge": -2,
  "composition": [
    {
      "symbol": "C",
      "count": 1,
      "atomic_weight": "12.011",
      "subtotal": "12.011"
    },
    {
      "symbol": "O",
      "count": 3,
      "atomic_weight": "15.999",
      "subtotal": "47.997"
    }
  ],
  "molar_mass_g_per_mol": "60.008",
  "summary": "A polyatomic ion: one carbon and three oxygens carrying a 2- charge as a single unit. It stays intact through a reaction — you carry $\\mathrm{CO_3^{2-}}$ around whole, never as loose C and O. Its molar mass sums the four atoms; the tiny mass of the two extra electrons is conventionally ignored.",
  "regime": "ledger-exact",
  "source": "ciaaw-2021-atomic-weights",
  "related": [
    {
      "to": "polyatomic-ion",
      "type": "instance-of"
    },
    {
      "to": "calcium-carbonate",
      "type": "component-of"
    },
    {
      "to": "sodium-carbonate",
      "type": "component-of"
    }
  ],
  "lessons": [
    "calcium-carbonate-limiting"
  ],
  "phase": "aq",
  "notes": [
    "The 2- charge is the sourced ionic charge (see the Valence Table); the composition and molar mass here are the machine-checked part."
  ],
  "reactions": [
    "reaction-precipitation",
    "reaction-gas-evolution"
  ]
}
